{"totalCount":9,"count":9,"areas":[{"booliId":76,"name":"Nacka","types":["Kommun"],"parentBooliId":2,"parentName":"Stockholms l\u00e4n","parentTypes":["L\u00e4n"],"fullName":"Nacka, Stockholms l\u00e4n","urlFriendlyName":"nacka"},{"booliId":930508,"name":"Nacka Strand","types":["undefined"],"parentBooliId":76,"parentName":"Nacka","parentTypes":["Kommun"],"fullName":"Nacka Strand, Nacka","urlFriendlyName":"nacka+strand"},{"booliId":24617,"name":"Nacka Forum","types":["undefined"],"parentBooliId":76,"parentName":"Nacka","parentTypes":["Kommun"],"fullName":"Nacka Forum, Nacka","urlFriendlyName":"nacka+forum"},{"booliId":940036,"name":"Finntorp Nacka","types":["undefined"],"parentBooliId":76,"parentName":"Nacka","parentTypes":["Kommun"],"fullName":"Finntorp Nacka, Nacka","urlFriendlyName":"finntorp+nacka"},{"booliId":965203,"name":"Ektorp Nacka","types":["undefined"],"parentBooliId":76,"parentName":"Nacka","parentTypes":["Kommun"],"fullName":"Ektorp Nacka, Nacka","urlFriendlyName":"ektorp+nacka"},{"booliId":930392,"name":"Nacka Saltsj\u00f6qvarn","types":["undefined"],"parentBooliId":1,"parentName":"Stockholm","parentTypes":["Kommun"],"fullName":"Nacka Saltsj\u00f6qvarn, Stockholm","urlFriendlyName":"nacka+saltsjoqvarn"},{"booliId":937057,"name":"Jarlaberg-Nacka","types":["undefined"],"parentBooliId":76,"parentName":"Nacka","parentTypes":["Kommun"],"fullName":"Jarlaberg-Nacka, Nacka","urlFriendlyName":"jarlaberg-nacka"},{"booliId":966438,"name":"Henriksdalsberget Nacka","types":["undefined"],"parentBooliId":76,"parentName":"Nacka","parentTypes":["Kommun"],"fullName":"Henriksdalsberget Nacka, Nacka","urlFriendlyName":"henriksdalsberget+nacka"},{"booliId":106799,"name":"Nackagatan","types":["Street"],"parentBooliId":1,"parentName":"Stockholm","parentTypes":["Kommun"],"fullName":"Nackagatan, Stockholm","urlFriendlyName":"nackagatan"}],"searchParams":{"q":"Nacka","listings":1,"transactions":0},"limit":30}